"id","acronym","name","category","description","collections","hasAIApplication","isMature","concerns_data_topic","has_relevant_organization","responsible_organization","isOpen","registration","URL","formalSpec","publication","trainingResources","subclassOf","contributionDate","relatedTo","usedInBridge2AI","topic","relevantOrgNames","responsibleOrgAcronym","responsibleOrgName"
"B2AI_STANDARD:141","GCDML","Genomic Contextual Data Markup Language","Biomedical Standard","The Genomic Contextual Data Markup Language (GCDML) is a core project of the Genomic Standards Consortium (GSC) that is a reference implementation the Minimum Information about a Genome Sequence (MIGS/MIMS/MIMARKS), and the extensions the Minimum Information about a Metagenome Sequence (MIMS) and Minimum Information about a MARKer gene Sequence (MIMARKS).","[""markuplanguage""]","No","No","[""B2AI_TOPIC:13""]",,"[""B2AI_ORG:38""]","Yes","No",,,"doi:10.1089/omi.2008.0A10",,,,,"No","[""Genome""]",,"[""GSC""]","[""Genomic Standards Consortium""]"
"B2AI_STANDARD:142","GGBN","Global Genome Biodiversity Network Data Standard","Biomedical Standard","In order to facilitate exchange of information on genomic samples and their derived data, the Global Genome Biodiversity Network (GGBN) Data Standard is intended to provide a platform based on a documented agreement to promote the efficient sharing and usage of genomic sample material and associated specimen information in a consistent way.",,"No","No","[""B2AI_TOPIC:13""]","[""B2AI_ORG:93""]","[""B2AI_ORG:93""]","Yes","No","https://www.tdwg.org/standards/ggbn/",,"doi:10.1093/database/baw125",,,,,"No","[""Genome""]","[""TDWG""]","[""TDWG""]","[""Biodiversity Information Standards""]"
"B2AI_STANDARD:143","GlycoCT","GlycoCT encoding scheme","Biomedical Standard","GlycoCT format is devised to describe the carbohydrate sequences, with a controlled vocabulary to name monosaccharides, adopting IUPAC rules to generate a consistent, machine-readable nomenclature, based on a connection table approach, instead of a linear encoding scheme. The format uses a block concept to describe frequently occurring special features of carbohydrate sequences like repeating units. It exists in two variants, a condensed form and a more verbose XML syntax. Sorting rules assure the uniqueness of the condensed form, thus making it suitable as a direct primary key for database applications, which rely on unique identifiers. GlycoCT encompasses the capabilities of the heterogeneous landscape of digital encoding schemata in glycomics and is thus a step forward on the way to a unified and broadly accepted sequence format in glycobioinformatics.",,"No","No","[""B2AI_TOPIC:20""]",,,"Yes","No",,"https://github.com/glycoinfo/GlycoCT","doi:10.1016/j.carres.2008.03.011",,,,,"No","[""Molecular Biology""]",,,
"B2AI_STANDARD:144","GTrack","GTrack genomic data format","Biomedical Standard","GTrack is a tabular format that was developed as part of the Genomic HyperBrowser system to provide a uniform representation of most types of genomic datasets. GTrack is able to replace common formats such as WIG, GFF, BED, FASTA, in addition to represent chromatin capture datasets, such as Hi-C and ChIA-PET.","[""fileformat""]","No","No","[""B2AI_TOPIC:13""]",,,"Yes","No",,"https://github.com/gtrack/gtrack","doi:10.1186/1471-2105-12-494",,,,,"No","[""Genome""]",,,
"B2AI_STANDARD:145","GUID-AS","GUID and Life Sciences Identifiers Applicability Statements","Biomedical Standard","GUIDs are Globally Unique Identifiers which should be referentially consistent and resolvable in order to support tests of uniqueness and the acquisition of associated metadata. Further, permanent and robust resolution services need to be available. The TDWG Globally Unique Identifiers Task Group (TDWG GUID), after meeting twice in 2006, recommended the use of the Life Sciences Identifiers (LSID) to uniquely identify shared data objects in the biodiversity domain.","[""guidelines""]","No","No","[""B2AI_TOPIC:20""]","[""B2AI_ORG:93""]","[""B2AI_ORG:93""]","Yes","No","http://www.tdwg.org/standards/150","https://github.com/tdwg/guid-as",,,,,,"No","[""Molecular Biology""]","[""TDWG""]","[""TDWG""]","[""Biodiversity Information Standards""]"
"B2AI_STANDARD:146","GIATE","Guidelines for Information About Therapy Experiments","Biomedical Standard","A minimum information checklist creating a consistent framework to transparently report the purpose, methods and results of the therapeutic experiments","[""minimuminformationschema""]","No","No","[""B2AI_TOPIC:4""]",,,"Yes","No",,,"doi:10.1186/1756-0500-5-10",,,,,"No","[""Clinical Observations""]",,,
"B2AI_STANDARD:147","HIPAA","Health Insurance Portability and Accountability Act of 1996","Biomedical Standard","The Health Insurance Portability and Accountability Act of 1996 (HIPAA) is a federal law that required the creation of national standards to protect sensitive patient health information from being disclosed without the patient’s consent or knowledge. The US Department of Health and Human Services (HHS) issued the HIPAA Privacy Rule to implement the requirements of HIPAA. The HIPAA Security Rule protects a subset of information covered by the Privacy Rule.","[""policy""]","No","No","[""B2AI_TOPIC:9""]","[""B2AI_ORG:39""]","[""B2AI_ORG:39""]","Yes","No","https://www.hhs.gov/hipaa/index.html","https://aspe.hhs.gov/reports/health-insurance-portability-accountability-act-1996",,,,,,"Yes","[""EHR""]","[""HHS""]","[""HHS""]","[""United States Department of Health and Human Services""]"
"B2AI_STANDARD:148","HCPCS","Healthcare Common Procedure Coding System","Biomedical Standard","Code set for items and supplies and non-physician services not covered by the American Medical Association's Current Procedural Terminology-4 (CPT-4) codes; Medicare, Medicaid, and private health insurers use HCPCS procedure and modifier codes for claims processing.","[""codesystem"", ""standards_process_maturity_final"", ""implementation_maturity_production""]","No","Yes","[""B2AI_TOPIC:9""]","[""B2AI_ORG:17""]","[""B2AI_ORG:17""]","Yes","No","https://www.cms.gov/Medicare/Coding/HCPCSReleaseCodeSets",,,,,,,"Yes","[""EHR""]","[""CMS""]","[""CMS""]","[""U.S. Centers for Medicare & Medicaid Services""]"
"B2AI_STANDARD:149","HISPID3","Herbarium Information Standards and Protocols for Interchange of Data","Biomedical Standard","The 'Herbarium Information Standards and Protocols for Interchange of Data' (HISPID) is a standard format for the interchange of electronic herbarium specimen information. HISPID has been developed by a committee of representatives from all major Australian herbaria. This interchange standard was first published in 1989, with a revised version published in 1993./nHISPID3 (version 3) is an accession-based interchange standard. Although many fields refer to attributes of the taxon they should be construed as applying to the specimen represented by the record, not to the taxon per se. The interchange of taxonomic, nomenclatural, bibliographic, typification, rare and endangered plant conservation, and other related information is not dealt with in this standard, unless it specifically refers to a particular accession (record). While this standard is still in use, it is no longer actively maintained (labelled as prior on the TDWG website).",,"No","No","[""B2AI_TOPIC:1""]","[""B2AI_ORG:93""]","[""B2AI_ORG:93""]","Yes","No","https://www.tdwg.org/standards/hispid3/",,,,,,,"No","[""Biology""]","[""TDWG""]","[""TDWG""]","[""Biodiversity Information Standards""]"
"B2AI_STANDARD:150","HML","Histoimmunogenetics Markup Language","Biomedical Standard","Histoimmunogenetics Markup Language (HML) is intended as a potentially general-purpose XML format for exchanging genetic typing data. This format supports NGS based genotyping methods, raw sequence reads, registered methodologies, reference data, complete reporting of allele and genotype ambiguity and MIRING compliant reporting.","[""markuplanguage""]","No","No","[""B2AI_TOPIC:5""]",,,"Yes","No","https://bioinformatics.bethematchclinical.org/hla-resources/hml/","https://github.com/nmdp-bioinformatics/hml",,,,,,"No","[""Data""]",,,
"B2AI_STANDARD:151","Arden","HL7 Arden Syntax","Biomedical Standard","The Arden Syntax for Medical Logic Systems Version 2.10 is the latest version of a formalism for clinical knowledge representation that can be used by clinicians, knowledge engineers, administrators and others to implement clinical decision support (CDS) solutions to help improve the quality and safety of care. Arden Syntax can be used to create a knowledge base for CDS systems that, when coupled with patient data, can generate patient-specific CDS interventions for improving patient care. The key change in Version 2.10 over Version 2.9 is inclusion of a normative XML representation for Arden Syntax. This was done because the use of XML facilitates the development of tools such as syntax checkers and editors that can help increase the correctness of executable knowledge modules, and this in turn will foster the augmentation of the development and production environments for Arden, thereby increasing its utility.",,"No","No","[""B2AI_TOPIC:5""]","[""B2AI_ORG:40""]","[""B2AI_ORG:40""]","Yes","Yes","http://www.hl7.org/implement/standards/product_brief.cfm?product_id=372","https://www.hl7.org/login/index.cfm?next=/implement/standards/product_brief.cfm?product_id=2","doi:10.1016/j.jbi.2012.02.001",,,,,"No","[""Data""]","[""HL7""]","[""HL7""]","[""Health Level Seven""]"
"B2AI_STANDARD:152","HL7 CDA Data Provenance","HL7 Clinical Document Architecture Implementation Guide - Data Provenance","Biomedical Standard","Guidance and templates for basic provenance information about clinical (and other care related information), who created it, when was it created, where was it created, how it was created, and why it was created.",,"No","No","[""B2AI_TOPIC:9""]","[""B2AI_ORG:40""]","[""B2AI_ORG:40""]","Yes","Yes","http://www.hl7.org/implement/standards/product_brief.cfm?product_id=420",,,,,,,"No","[""EHR""]","[""HL7""]","[""HL7""]","[""Health Level Seven""]"
"B2AI_STANDARD:153","DiagnosticReport","HL7 FHIR Resource DiagnosticReport","Biomedical Standard","Resource for findings and interpretation of diagnostic tests performed on patients, groups of patients, devices, and locations, and/or specimens derived from these. The report includes clinical context such as requesting and provider information, and some mix of atomic results, images, textual and coded interpretations, and formatted representation of diagnostic reports.",,"No","No","[""B2AI_TOPIC:9""]","[""B2AI_ORG:40""]","[""B2AI_ORG:40""]","Yes","No","http://hl7.org/fhir/diagnosticreport.html","http://hl7.org/fhir/diagnosticreport-definitions.html",,"[""B2AI_STANDARD:845"", ""B2AI_STANDARD:846"", ""B2AI_STANDARD:847"", ""B2AI_STANDARD:850""]",,,,"No","[""EHR""]","[""HL7""]","[""HL7""]","[""Health Level Seven""]"
"B2AI_STANDARD:154","GenomicStudy","HL7 FHIR Resource GenomicStudy","Biomedical Standard","GenomicStudy resource aims at delineating relevant information of a genomic study. A genomic study might comprise one or more analyses, each serving a specific purpose. These analyses may vary in method (e.g., karyotyping, CNV, or SNV detection), performer, software, devices used, or regions targeted.",,"No","No","[""B2AI_TOPIC:9"", ""B2AI_TOPIC:13""]","[""B2AI_ORG:40""]","[""B2AI_ORG:40""]","Yes","No","https://build.fhir.org/genomicstudy.html","https://build.fhir.org/genomicstudy-definitions.html",,"[""B2AI_STANDARD:845"", ""B2AI_STANDARD:846"", ""B2AI_STANDARD:847"", ""B2AI_STANDARD:850""]",,,,"No","[""EHR"", ""Genome""]","[""HL7""]","[""HL7""]","[""Health Level Seven""]"
"B2AI_STANDARD:155","MolecularSequence","HL7 FHIR Resource MolecularSequence","Biomedical Standard","Resource for raw data describing a biological sequence.",,"No","No","[""B2AI_TOPIC:4"", ""B2AI_TOPIC:20""]","[""B2AI_ORG:40""]","[""B2AI_ORG:40""]","Yes","No","http://hl7.org/implement/standards/fhir/molecularsequence.html","http://hl7.org/implement/standards/fhir/molecularsequence-definitions.html",,"[""B2AI_STANDARD:845"", ""B2AI_STANDARD:846"", ""B2AI_STANDARD:847"", ""B2AI_STANDARD:850""]",,,,"No","[""Clinical Observations"", ""Molecular Biology""]","[""HL7""]","[""HL7""]","[""Health Level Seven""]"
"B2AI_STANDARD:156","Observation","HL7 FHIR Resource Observation","Biomedical Standard","Resource for measurements and simple assertions made about a patient, device or other subject.",,"No","No","[""B2AI_TOPIC:9""]","[""B2AI_ORG:40""]","[""B2AI_ORG:40""]","Yes","No","http://hl7.org/implement/standards/fhir/observation.html","http://hl7.org/implement/standards/fhir/observation-definitions.html",,"[""B2AI_STANDARD:845"", ""B2AI_STANDARD:846"", ""B2AI_STANDARD:847"", ""B2AI_STANDARD:850""]",,,,"No","[""EHR""]","[""HL7""]","[""HL7""]","[""Health Level Seven""]"
"B2AI_STANDARD:157","Patient","HL7 FHIR Resource Patient","Biomedical Standard","Resource for demographics and other administrative information about an individual or animal receiving care or other health-related services.",,"No","No","[""B2AI_TOPIC:6"", ""B2AI_TOPIC:9""]","[""B2AI_ORG:40""]","[""B2AI_ORG:40""]","Yes","No","http://hl7.org/implement/standards/fhir/patient.html","http://hl7.org/implement/standards/fhir/patient-definitions.html",,"[""B2AI_STANDARD:845"", ""B2AI_STANDARD:846"", ""B2AI_STANDARD:847"", ""B2AI_STANDARD:850""]",,,,"No","[""Demographics"", ""EHR""]","[""HL7""]","[""HL7""]","[""Health Level Seven""]"
"B2AI_STANDARD:158","Specimen","HL7 FHIR Resource Specimen","Biomedical Standard","Resource for any material sample taken from a biological entity, living or dead, or taken from a physical object or the environment.",,"No","No","[""B2AI_TOPIC:9""]","[""B2AI_ORG:40""]","[""B2AI_ORG:40""]","Yes","No","http://hl7.org/fhir/specimen.html","http://hl7.org/fhir/specimen-definitions.html",,"[""B2AI_STANDARD:845"", ""B2AI_STANDARD:846"", ""B2AI_STANDARD:847"", ""B2AI_STANDARD:850""]",,,,"No","[""EHR""]","[""HL7""]","[""HL7""]","[""Health Level Seven""]"
"B2AI_STANDARD:159","GHP","HL7 Gender Harmony Project","Biomedical Standard","Currently, it is common that a single data element is used to capture both sex and gender information, often assuming these two items are one unified idea. This specification challenges that notion and proposes that independent consideration of sex and gender, and the assessment of their differences promotes the health of women, men, and people of diverse gender identities of all ages, avoiding systematic errors that generate results with a low validity (if any) in clinical studies. The Gender Harmony model describes an approach that can improve data accuracy for sex and gender information in health care systems.",,"No","No","[""B2AI_TOPIC:6""]","[""B2AI_ORG:40""]","[""B2AI_ORG:40""]","Yes","Yes","http://www.hl7.org/implement/standards/product_brief.cfm?product_id=564",,"doi:10.1093/jamia/ocab196",,,,,"No","[""Demographics""]","[""HL7""]","[""HL7""]","[""Health Level Seven""]"
"B2AI_STANDARD:160","TraML","HUPO-PSI TraML format","Biomedical Standard","The HUPO PSI Mass Spectrometry Standards Working Group (MSS WG) has developed a specification for a standardized format for the exchange and transmission of transition lists for selected reaction monitoring (SRM) experiments.","[""fileformat""]","No","No","[""B2AI_TOPIC:28""]","[""B2AI_ORG:41""]","[""B2AI_ORG:41""]","Yes","No","https://www.psidev.info/traml",,,,,,,"No","[""Proteome""]","[""HUPO-PSI""]","[""HUPO-PSI""]","[""Human Proteome Organization Proteomics Standards Initiative""]"
"B2AI_STANDARD:161","IEEE P360","IEEE 360-2022 IEEE Standard for Wearable Consumer Electronic Devices","Biomedical Standard","An overview, terminology, and categorization for Wearable Consumer Electronic Devices (Wearables). It further outlines an architecture for a series of standard specifications that define technical requirements and testing methods for different aspects of Wearables, from basic security and suitableness of wearing to various functional areas like health, fitness, and infotainment, etc.",,"No","No","[""B2AI_TOPIC:18""]","[""B2AI_ORG:44""]","[""B2AI_ORG:44""]","No","Yes","https://standards.ieee.org/ieee/360/6244/",,,,,,,"No","[""mHealth""]","[""IEEE""]","[""IEEE""]","[""Institute of Electrical and Electronics Engineers""]"
"B2AI_STANDARD:162","BPPC","IHE Basic Patient Privacy Consents","Biomedical Standard","A mechanism to record the patient privacy consent(s) and a method for Content Consumers to use to enforce the privacy consent appropriate to the use.",,"No","No","[""B2AI_TOPIC:9""]","[""B2AI_ORG:46""]","[""B2AI_ORG:46""]","Yes","No",,"https://profiles.ihe.net/ITI/TF/Volume1/ch-19.html",,,,,,"No","[""EHR""]","[""IHE""]","[""IHE""]","[""Integrating the Healthcare Enterprise""]"
"B2AI_STANDARD:163","IHE CDS-OAT","IHE Clinical Decision Support Order Appropriateness Tracking","Biomedical Standard","Profile for Clinical Decision Support and Appropriate Use Criteria (AUC) information as received from the CDS Mechanism 145 (CDSM) on the order and charge transaction to the revenue cycle application that is responsible to create a claim.",,"No","No","[""B2AI_TOPIC:5""]","[""B2AI_ORG:46""]","[""B2AI_ORG:46""]","Yes","No","https://www.ihe.net/uploadedFiles/Documents/Radiology/IHE_Rad_Suppl_CDS-OAT.pdf",,,,,,,"No","[""Data""]","[""IHE""]","[""IHE""]","[""Integrating the Healthcare Enterprise""]"
"B2AI_STANDARD:164","CRD","IHE Clinical Research Document standard","Biomedical Standard","The Clinical Research Document Profile (CRD) specifies a standard way to generate a clinical research document from EHR data provided in the CDA standard.",,"No","No","[""B2AI_TOPIC:5""]","[""B2AI_ORG:46""]","[""B2AI_ORG:46""]","Yes","No",,"https://www.ihe.net/uploadedFiles/Documents/QRPH/IHE_QRPH_Suppl_CRD.pdf",,,,,,"No","[""Data""]","[""IHE""]","[""IHE""]","[""Integrating the Healthcare Enterprise""]"
"B2AI_STANDARD:165","IHE XCPD","IHE Cross-Community Patient Discovery Profile","Biomedical Standard","Standardized means to locate communities that hold patient relevant health data and the translation of patient identifiers across communities holding the same patient’s data.",,"No","No","[""B2AI_TOPIC:5""]","[""B2AI_ORG:46""]","[""B2AI_ORG:46""]","Yes","No","https://profiles.ihe.net/ITI/TF/Volume1/ch-27.html",,,,,,,"No","[""Data""]","[""IHE""]","[""IHE""]","[""Integrating the Healthcare Enterprise""]"
"B2AI_STANDARD:166","IHE ITI","IHE IT Infrastructure Technical Framework","Biomedical Standard","Technical profiles and definitions for IT use cases, transactions, content, and metadata.",,"No","No","[""B2AI_TOPIC:5""]","[""B2AI_ORG:46""]","[""B2AI_ORG:46""]","Yes","No","https://profiles.ihe.net/ITI/index.html","https://profiles.ihe.net/ITI/TF/index.html",,,,,,"No","[""Data""]","[""IHE""]","[""IHE""]","[""Integrating the Healthcare Enterprise""]"
"B2AI_STANDARD:167","LAW","IHE Laboratory Analytical Workflow","Biomedical Standard","Profile to support the analytical workflow between analyzers of the clinical laboratory and the IT systems managing their work",,"No","No","[""B2AI_TOPIC:5""]","[""B2AI_ORG:46""]","[""B2AI_ORG:46""]","Yes","No","https://www.ihe.net/resources/technical_frameworks/#PaLM","https://www.ihe.net/uploadedFiles/Documents/PaLM/IHE_PaLM_TF_Vol1.pdf",,,,,,"No","[""Data""]","[""IHE""]","[""IHE""]","[""Integrating the Healthcare Enterprise""]"
"B2AI_STANDARD:168","IHE PCD","IHE Patient Care Device Profiles","Biomedical Standard","Standards for medical device communication.",,"No","No","[""B2AI_TOPIC:5""]","[""B2AI_ORG:46""]","[""B2AI_ORG:46""]","Yes","No","https://wiki.ihe.net/index.php?title=PCD_Profiles",,,,,,,"No","[""Data""]","[""IHE""]","[""IHE""]","[""Integrating the Healthcare Enterprise""]"
"B2AI_STANDARD:169","IHE PDQ","IHE Patient Demographics Query Integration Profile","Biomedical Standard","Standardized ways for multiple distributed applications to query a patient information server for a list of patients, based on user-defined search criteria, and retrieve a patient’s demographic (and, optionally, visit or visit-related) information directly into the application.",,"No","No","[""B2AI_TOPIC:5""]","[""B2AI_ORG:46""]","[""B2AI_ORG:46""]","Yes","No","https://profiles.ihe.net/ITI/TF/Volume1/ch-8.html",,,,,,,"No","[""Data""]","[""IHE""]","[""IHE""]","[""Integrating the Healthcare Enterprise""]"
"B2AI_STANDARD:170","RFD","IHE Retrieve Form for Data Capture","Biomedical Standard","The RFD Profile provides a generic polling mechanism to allow an external agency to indicate issues with data that have been captured and enable the healthcare provider to correct the data. The profile does not dictate the mechanism employed or content required to achieve such corrections.",,"No","No","[""B2AI_TOPIC:4""]","[""B2AI_ORG:46""]","[""B2AI_ORG:46""]","Yes","No","https://profiles.ihe.net/ITI/TF/Volume1/ch-17.html",,,,,,,"No","[""Clinical Observations""]","[""IHE""]","[""IHE""]","[""Integrating the Healthcare Enterprise""]"
"B2AI_STANDARD:171","LIVD","IICC Digital Format for Publication of LOINC to Vendor IVD Test Results","Biomedical Standard","Industry-defined format to facilitate the publication and exchange of LOINC codes for vendor IVD test results.",,"No","No","[""B2AI_TOPIC:5""]","[""B2AI_ORG:53""]",,"Yes","No","https://ivdconnectivity.org/livd/",,,"[""B2AI_STANDARD:848""]",,,,"No","[""Data""]","[""LOINC""]",,
"B2AI_STANDARD:172","ICS","Image Cytometry Standard","Biomedical Standard","The Image Cytometry Standard (ICS) is a digital multidimensional image file format used in life sciences microscopy. It stores not only the image data, but also the microscopic parameters describing the optics during the acquisition.","[""fileformat""]","No","No","[""B2AI_TOPIC:19""]",,,"Yes","No","https://en.wikipedia.org/wiki/Image_Cytometry_Standard",,"doi:10.1002/cyto.990110502",,,,,"No","[""Microscale Imaging""]",,,
"B2AI_STANDARD:173","imzML","imzML format","Biomedical Standard","The purpose of imzML is to facilitate the exchange and processing of mass spectrometry imaging data. This website is intended to provide all information neccesary to implement imzML.imzML was developed in the framework of the EU funded project COMPUTIS. The main goals during the development were complete description of MS imaging experiments and efficient storage of (very large) data sets. imzML is it not limited to MS imaging, but is also useful for other MS applications generating large data sets such as LC-FTMS. The current version is mzML 1.1.0. The metadata part of imzML is based on the mzML format by HUPO-PSI","[""fileformat""]","No","No","[""B2AI_TOPIC:15"", ""B2AI_TOPIC:28""]","[""B2AI_ORG:20""]",,"Yes","No","https://ms-imaging.org/imzml/",,"doi:10.1016/j.jprot.2012.07.026",,,,,"No","[""Image"", ""Proteome""]","[""COMPUTIS""]",,
"B2AI_STANDARD:174","ICD-10-CM","International Classification of Diseases 10th Revision Clinical Modification","Biomedical Standard","Diseases and diagnostic categories","[""codesystem"", ""standards_process_maturity_final"", ""implementation_maturity_production""]","No","Yes","[""B2AI_TOPIC:9""]","[""B2AI_ORG:14""]","[""B2AI_ORG:14""]","Yes","No","https://www.cdc.gov/nchs/icd/icd-10-cm.htm",,,,,,,"Yes","[""EHR""]","[""CDC NCHS""]","[""CDC NCHS""]","[""CDC National Center for Health Statistics""]"
"B2AI_STANDARD:175","ICD-11","International Classification of Diseases 11th Revision","Biomedical Standard","Diseases and diagnostic categories","[""codesystem"", ""standards_process_maturity_final""]","No","Yes","[""B2AI_TOPIC:9""]","[""B2AI_ORG:100""]","[""B2AI_ORG:100""]","Yes","No","https://icd.who.int/en",,,,,,,"No","[""EHR""]","[""WHO""]","[""WHO""]","[""World Health Organisation""]"
"B2AI_STANDARD:176","ICD-9-CM","International Classification of Diseases 9th Revision Clinical Modification","Biomedical Standard","Diseases and diagnostic categories","[""codesystem""]","No","No","[""B2AI_TOPIC:9""]","[""B2AI_ORG:14""]","[""B2AI_ORG:14""]","Yes","No","https://www.cdc.gov/nchs/icd/icd9cm.htm",,,,,,,"Yes","[""EHR""]","[""CDC NCHS""]","[""CDC NCHS""]","[""CDC National Center for Health Statistics""]"
"B2AI_STANDARD:177","INTRPRT","INTRPRT guidelines for transparent machine learning for medical image analysis","Biomedical Standard","A design directive for transparent ML systems in medical image analysis. The INTRPRT guideline suggests human-centered design principles, recommending formative user research as the first step to understand user needs and domain requirements.","[""guidelines""]","No","No","[""B2AI_TOPIC:15""]",,,"Yes","No",,,"doi:10.1038/s41746-022-00699-2",,,,,"No","[""Image""]",,,
"B2AI_STANDARD:178","IPSM-AF","IPSM Alignment Format","Biomedical Standard","Alignment can be interpreted as a set of uni-directional mappings for transforming input RDF graph into output RDF graph. It is persisted in IPSM Alignment Format (IPSM-AF) that is based on a well known Alignment API Format.",,"No","No","[""B2AI_TOPIC:21""]",,,"Yes","No","https://inter-iot.readthedocs.io/projects/ipsm/en/latest/Configuration/Alignment-format/IPSM-alignment-format/","https://github.com/INTER-IoT/ipsm-alignments",,,,,,"No","[""Networks And Pathways""]",,,
"B2AI_STANDARD:179","ISA-TAB-Nano","ISA-Tab-Nano format","Biomedical Standard","ISA-TAB-Nano specifies the format for representing and sharing information about nanomaterials, small molecules and biological specimens along with their assay characterization data (including metadata, and summary data) using spreadsheet or TAB-delimited files.","[""fileformat""]","No","No","[""B2AI_TOPIC:5""]","[""B2AI_ORG:47""]",,"Yes","No","https://wiki.nci.nih.gov/display/icr/isa-tab-nano",,"doi:10.1186/1472-6750-13-2",,,,,"No","[""Data""]","[""ISA Commons""]",,
