"id","acronym","name","category","description","collections","hasAIApplication","isMature","concerns_data_topic","has_relevant_organization","responsible_organization","isOpen","registration","URL","formalSpec","publication","trainingResources","subclassOf","contributionDate","relatedTo","usedInBridge2AI","topic","relevantOrgNames","responsibleOrgAcronym","responsibleOrgName"
"B2AI_STANDARD:324","DataCite","DataCite Metadata Schema","Data Standard","The DataCite Metadata Schema is a list of core metadata properties chosen for the accurate and consistent identification of a resource for citation and retrieval purposes, along with recommended use instructions. The resource that is being identified can be of any kind, but it is typically a dataset. We use the term ‘dataset’ in its broadest sense. We mean it to include not only numerical data, but any other research data outputs.",,"No","No","[""B2AI_TOPIC:5""]",,,"Yes","No","https://schema.datacite.org/","https://schema.datacite.org/meta/kernel-4.3/metadata.xsd",,,,,,"No","[""Data""]",,,
"B2AI_STANDARD:325","Dataset Cards","Dataset Cards","Data Standard","Describe datasets.",,"No","No","[""B2AI_TOPIC:5""]",,,"Yes","No","https://huggingface.co/docs/datasets/dataset_card",,,,,,,"No","[""Data""]",,,
"B2AI_STANDARD:326","Datasheets","Datasheets for Datasets","Data Standard","...we propose that every dataset be accompanied with a datasheet that documents its motivation, composition, collection process, recommended uses, and so on.","[""datasheets""]","No","No","[""B2AI_TOPIC:5""]",,,"Yes","No",,,"https://arxiv.org/abs/1803.09010",,,,,"No","[""Data""]",,,
"B2AI_STANDARD:327","XGMML","eXtensible Graph Markup and Modeling Language","Data Standard","eXtensible Graph Markup and Modeling Language is an XML application based on GML which is used for graph description. XGMML uses tags to describe nodes and edges of a graph. The purpose of XGMML is to make possible the exchange of graphs between differents authoring and browsing tools for graphs.","[""markuplanguage""]","No","No","[""B2AI_TOPIC:21""]",,,"Yes","No","http://xml.coverpages.org/xgmml.html",,,,,,,"No","[""Networks And Pathways""]",,,
"B2AI_STANDARD:328","FAIR4RS","FAIR Principles for Research Software","Data Standard","Simple and research software appropriate goalposts to inform those who publish and/or preserve research software.","[""guidelines""]","No","No","[""B2AI_TOPIC:5""]","[""B2AI_ORG:83""]",,"Yes","No","https://www.rd-alliance.org/group/fair-research-software-fair4rs-wg/outcomes/fair-principles-research-software-fair4rs",,"doi:10.1038/s41597-022-01710-x",,,,,"No","[""Data""]","[""RDA""]",,
"B2AI_STANDARD:329","FIPS","Federal Information Processing System Codes for States and Counties","Data Standard","FIPS codes are numbers which uniquely identify geographic areas. As of database version 55, FIPS has been merged with the Geographic Names Information System (GNIS).","[""codesystem"", ""deprecated""]","No","No","[""B2AI_TOPIC:6""]",,,"Yes","No",,"https://transition.fcc.gov/oet/info/maps/census/fips/fips.txt",,,,,,"No","[""Demographics""]",,,
"B2AI_STANDARD:330","FieldML","FieldML","Data Standard","FieldML is a declarative language for building hierarchical models represented by generalized mathematical fields. FieldML is developed as a data model and accompanying API. Find out more about the FieldML API, where to get the latest release and how to contribute to its development. FieldML is a declarative language for representing hierarchical models using generalized mathematical fields. FieldML can be used to represent the dynamic 3D geometry and solution fields from computational models of cells, tissues and organs. It enables model interchange for the bioengineering and general engineering analysis communities. Example uses are models of tissue structure, the distribution of proteins and other biochemical compounds, anatomical annotation, and other biological annotation.","[""markuplanguage""]","No","No","[""B2AI_TOPIC:5""]",,,"Yes","No",,,"doi:10.1007/s11517-013-1097-7",,,,,"No","[""Data""]",,,
"B2AI_STANDARD:331","FLAC","Free Lossless Audio Codec","Data Standard","FLAC (Free Lossless Audio Codec) is an audio coding format for lossless compression of digital audio.","[""audiovisual"", ""fileformat""]","No","No","[""B2AI_TOPIC:37""]",,,"Yes","No","https://en.wikipedia.org/wiki/FLAC","https://xiph.org/flac/format.html",,,,,,"No","[""Waveform""]",,,
"B2AI_STANDARD:332","Frictionless","Frictionless Data Package","Data Standard","Describe datasets.",,"No","No","[""B2AI_TOPIC:5""]",,,"Yes","No","https://specs.frictionlessdata.io/data-package/","https://github.com/frictionlessdata/specs",,,,,,"No","[""Data""]",,,
"B2AI_STANDARD:333","serviceinfo","GA4GH serviceinfo","Data Standard","Provides a way for an API to expose a set of metadata to help discovery and aggregation of services via computational methods.",,"No","No","[""B2AI_TOPIC:5""]","[""B2AI_ORG:34""]",,"Yes","No","https://github.com/ga4gh-discovery/ga4gh-service-info",,,,,,,"No","[""Data""]","[""GA4GH""]",,
"B2AI_STANDARD:334","gxformat2","Galaxy workflow Format 2","Data Standard","A schema moving Galaxy's workflow description language toward standards such as the Common Workflow Language.","[""workflowlanguage""]","No","No","[""B2AI_TOPIC:20""]",,,"Yes","No",,"https://github.com/galaxyproject/gxformat2",,,,,"[""B2AI_STANDARD:766""]","No","[""Molecular Biology""]",,,
"B2AI_STANDARD:335","GNIS ID","Geographic Names Information System Feature IDs","Data Standard","The Geographic Names Information System (GNIS) is the Federal and national standard for geographic nomenclature. The U.S. Geological Survey's National Geospatial Program developed the GNIS in support of the U.S. Board on Geographic Names as the official repository of domestic geographic names data, the official vehicle for geographic names use by all departments of the Federal Government, and the source for applying geographic names to Federal electronic and printed products.",,"No","No","[""B2AI_TOPIC:14""]","[""B2AI_ORG:98""]",,"Yes","No","https://www.usgs.gov/us-board-on-geographic-names/domestic-names","https://www.usgs.gov/u.s.-board-on-geographic-names/download-gnis-data",,,,,,"No","[""Geolocation""]","[""USGS""]",,
"B2AI_STANDARD:336","GENC","Geopolitical Entities, Names, and Codes","Data Standard","The GENC Standard specifies a profile of ISO 3166 codes for the representation of names of countries and their subdivisions.","[""codesystem""]","No","No","[""B2AI_TOPIC:6""]",,,"Yes","No","https://www.dni.gov/index.php/who-we-are/organizations/ic-cio/ic-cio-related-menus/ic-cio-related-links/ic-technical-specifications/geopolitical-entities-names-and-codes","https://evs.nci.nih.gov/ftp1/GENC/",,,,,,"No","[""Demographics""]",,,
"B2AI_STANDARD:337","GraphML","Graph Markup Language","Data Standard","An XML file format and language for describing graphs.","[""fileformat"", ""markuplanguage""]","No","No","[""B2AI_TOPIC:21""]",,,"Yes","No","http://graphml.graphdrawing.org/specification.html",,,,,,"[""B2AI_STANDARD:829""]","No","[""Networks And Pathways""]",,,
"B2AI_STANDARD:338","GIF","Graphics Interchange Format","Data Standard","A bitmap image format.","[""fileformat""]","No","No","[""B2AI_TOPIC:15""]",,,"Yes","No","https://en.wikipedia.org/wiki/GIF",,,,,,,"No","[""Image""]",,,
"B2AI_STANDARD:339","HDF5","HDF5 format","Data Standard","HDF5 is a data model, library, and file format for storing and managing data. It supports an unlimited variety of datatypes, and is designed for flexible and efficient I/O and for high volume and complex data. HDF5 is portable and is extensible, allowing applications to evolve in their use of HDF5. The HDF5 Technology suite includes tools and applications for managing, manipulating, viewing, and analyzing data in the HDF5 format.","[""fileformat"", ""standards_process_maturity_final"", ""implementation_maturity_production""]","No","Yes","[""B2AI_TOPIC:5""]","[""B2AI_ORG:116""]",,"Yes","No","https://www.hdfgroup.org/solutions/hdf5/",,,,,,,"Yes","[""Data""]","[""Functional Genomics Grand Challenge""]",,
"B2AI_STANDARD:340","HDMF","HDMF format","Data Standard","HDF5 is a data model, library, and file format for storing and managing data. It supports an unlimited variety of datatypes, and is designed for flexible and efficient I/O and for high volume and complex data. HDF5 is portable and is extensible, allowing applications to evolve in their use of HDF5. The HDF5 Technology suite includes tools and applications for managing, manipulating, viewing, and analyzing data in the HDF5 format.","[""fileformat""]","No","No","[""B2AI_TOPIC:5""]",,,"Yes","No","https://hdmf-common-schema.readthedocs.io/en/latest/format.html","https://www.ncbi.nlm.nih.gov/pmc/articles/PMC8500680/","doi:10.1109/bigdata47090.2019.9005648",,,,"[""B2AI_STANDARD:339""]","No","[""Data""]",,,
"B2AI_STANDARD:341","ISA-Tab","ISA-Tab format","Data Standard","General-purpose ISA-Tab file format - an extensible, hierarchical structure that focuses on the description of the experimental metadata (i.e. sample characteristics, technology and measurement types, sample-to-data relationships).","[""fileformat""]","No","No","[""B2AI_TOPIC:5""]","[""B2AI_ORG:47""]",,"Yes","No","https://isa-specs.readthedocs.io/en/latest/isatab.html","https://github.com/ISA-tools/ISAdatasets",,,,,,"No","[""Data""]","[""ISA Commons""]",,
"B2AI_STANDARD:342","ISO 3166","ISO 3166 Country Codes","Data Standard","The purpose of ISO 3166 is to define internationally recognized codes of letters and/or numbers that we can use when we refer to countries and their subdivisions. However, it does not define the names of countries – this information comes from United Nations sources (Terminology Bulletin Country Names and the Country and Region Codes for Statistical Use maintained by the United Nations Statistics Divisions).","[""codesystem""]","No","No","[""B2AI_TOPIC:6""]","[""B2AI_ORG:49""]",,"Yes","No","https://www.iso.org/iso-3166-country-codes.html","https://en.wikipedia.org/wiki/List_of_ISO_3166_country_codes",,,,,,"No","[""Demographics""]","[""ISO""]",,
"B2AI_STANDARD:343","ISO 8601","ISO 8601 Date and time format","Data Standard","A way of presenting dates and times that is clearly defined and understandable to both people and machines.",,"No","No","[""B2AI_TOPIC:5""]","[""B2AI_ORG:49""]",,"Yes","No","https://www.iso.org/iso-8601-date-and-time-format.html",,,,,,,"No","[""Data""]","[""ISO""]",,
"B2AI_STANDARD:344","JPEG","Joint Photographic Experts Group Format","Data Standard","A method of lossy compression for digital images.","[""audiovisual"", ""fileformat"", ""has_ai_application"", ""standards_process_maturity_final"", ""implementation_maturity_production""]","Yes","Yes","[""B2AI_TOPIC:15""]","[""B2AI_ORG:116""]",,"Yes","No","https://en.wikipedia.org/wiki/JPEG",,,,,,,"Yes","[""Image""]","[""Functional Genomics Grand Challenge""]",,
"B2AI_STANDARD:345","JSON-schema","JSON-schema","Data Standard","JSON validation",,"No","No","[""B2AI_TOPIC:5""]",,,"Yes","No","https://json-schema.org/","https://github.com/json-schema-org/json-schema-spec",,,,,"[""B2AI_STANDARD:761""]","No","[""Data""]",,,
"B2AI_STANDARD:346","KGX","Knowledge Graph Exchange","Data Standard","linked knowledge","[""fileformat""]","No","No","[""B2AI_TOPIC:21""]",,,"Yes","No","https://github.com/biolink/kgx/blob/master/specification/kgx-format.md",,,,,,"[""B2AI_STANDARD:783""]","No","[""Networks And Pathways""]",,,
"B2AI_STANDARD:347","LinkML","LinkML","Data Standard","LinkML is a flexible modeling language that allows you to author schemas in YAML that describe the structure of your data. Additionally, it is a framework for working with and validating data in a variety of formats (JSON, RDF, TSV), with generators for compiling LinkML schemas to other frameworks.","[""markuplanguage"", ""has_ai_application"", ""standards_process_maturity_development"", ""implementation_maturity_pilot""]","Yes","No","[""B2AI_TOPIC:5""]","[""B2AI_ORG:116""]",,"Yes","No","https://linkml.io/linkml","https://github.com/linkml/linkml",,,,,,"Yes","[""Data""]","[""Functional Genomics Grand Challenge""]",,
"B2AI_STANDARD:348","MathML","MathML","Data Standard","A product of the W3C Math Working Group, MathML is a low-level specification for describing mathematics as a basis for machine to machine communication which provides a much needed foundation for the inclusion of mathematical expressions in Web pages. It is also important in publishing workflows for science and technology and wherever mathematics has to be handled by software.",,"No","No","[""B2AI_TOPIC:5""]","[""B2AI_ORG:99""]",,"Yes","No","https://www.w3.org/Math/whatIsMathML.html",,,,,,,"No","[""Data""]","[""W3C""]",,
"B2AI_STANDARD:349","xlsx","Microsoft Excel spreadsheet container file","Data Standard","Format used by Microsoft Excel spreadsheet software.","[""fileformat""]","No","No","[""B2AI_TOPIC:5""]","[""B2AI_ORG:56""]",,"No","No",,"https://www.iso.org/standard/71691.html",,,,,,"No","[""Data""]","[""Microsoft""]",,
"B2AI_STANDARD:350","Model Cards","Model Cards","Data Standard","Structured documentation detailing performance characteristics of machine learning models.","[""modelcards""]","No","No","[""B2AI_TOPIC:5""]","[""B2AI_ORG:37""]",,"Yes","No","https://modelcards.withgoogle.com/about","https://github.com/tensorflow/model-card-toolkit/blob/master/model_card_toolkit/schema/v0.0.2/model_card.schema.json","https://arxiv.org/abs/1810.03993",,,,,"No","[""Data""]","[""Google""]",,
"B2AI_STANDARD:351","MP3","MPEG-1 Audio Layer 3 | MPEG-2 Audio Layer 3","Data Standard","MP3 (formally MPEG-1 Audio Layer III or MPEG-2 Audio Layer III) is a coding format for digital audio.","[""audiovisual"", ""fileformat""]","No","No","[""B2AI_TOPIC:37""]",,,"Yes","No","https://en.wikipedia.org/wiki/MP3","https://www.iso.org/standard/26797.html",,,,,,"No","[""Waveform""]",,,
"B2AI_STANDARD:352","MPEG-4","MPEG-4 Part 14 digital multimedia container format","Data Standard","A digital multimedia container format most commonly used to store video and audio, but it can also be used to store other data such as subtitles and still images. Like most modern container formats, it allows streaming over the Internet.","[""audiovisual"", ""fileformat""]","No","No","[""B2AI_TOPIC:15"", ""B2AI_TOPIC:37""]","[""B2AI_ORG:49""]",,"Yes","No","https://en.wikipedia.org/wiki/MP4_file_format","https://www.loc.gov/preservation/digital/formats/fdd/fdd000155.shtml",,,,,,"No","[""Image"", ""Waveform""]","[""ISO""]",,
"B2AI_STANDARD:353","netCDF","Network Common Data Form","Data Standard","A standardized format for chromatographic data representation.","[""fileformat""]","No","No","[""B2AI_TOPIC:3"", ""B2AI_TOPIC:5""]","[""B2AI_ORG:8""]",,"Yes","No","https://www.unidata.ucar.edu/software/netcdf/","https://www.astm.org/e1947-98r14.html",,,,,,"No","[""Cheminformatics"", ""Data""]","[""ASTM""]",,
"B2AI_STANDARD:354","NNEF","Neural Network Exchange Format","Data Standard","An exchange format for neural network models produced using Torch, Caffe, TensorFlow, Theano, Chainer, Caffe2, PyTorch, or MXNet.","[""fileformat"", ""has_ai_application""]","Yes","No","[""B2AI_TOPIC:5""]",,,"Yes","No","https://www.khronos.org/nnef","https://github.com/KhronosGroup/NNEF-Tools",,,,,"[""B2AI_STANDARD:816"", ""B2AI_STANDARD:831"", ""B2AI_STANDARD:834""]","No","[""Data""]",,,
"B2AI_STANDARD:355","OMXML","OGC and ISO Observations and Measurements standard in XML","Data Standard","This standard specifies an XML implementation for the OGC and ISO Observations and Measurements (O&M) conceptual model (OGC Observations and Measurements v2.0 also published as ISO/DIS 19156), including a schema for Sampling Features. This encoding is an essential dependency for the OGC Sensor Observation Service (SOS) Interface Standard. More specifically, this standard defines XML schemas for observations, and for features involved in sampling when making observations. These provide document models for the exchange of information describing observation acts and their results, both within and between different scientific and technical communities.","[""markuplanguage""]","No","No","[""B2AI_TOPIC:5""]","[""B2AI_ORG:49""]",,"Yes","No","https://www.ogc.org/standards/om",,,,,,,"No","[""Data""]","[""ISO""]",,
"B2AI_STANDARD:356","OGG Speex","Ogg Speex Audio Format","Data Standard","File format and bitstream encoding for for spoken content, targeted at a wide range of devices other than mobile phones.","[""audiovisual"", ""fileformat""]","No","No","[""B2AI_TOPIC:37""]",,,"Yes","No","https://speex.org/docs/manual/speex-manual/node8.html",,,,,,,"No","[""Waveform""]",,,
"B2AI_STANDARD:357","ONNX","Open Neural Network Exchange","Data Standard","ONNX is an open format built to represent machine learning models.","[""fileformat"", ""has_ai_application""]","Yes","No","[""B2AI_TOPIC:5""]",,,"Yes","No","https://onnx.ai/","https://github.com/onnx/onnx/blob/main/docs/IR.md",,,,,,"No","[""Data""]",,,
"B2AI_STANDARD:358","OpenAPI","OpenAPI Specification","Data Standard","Standard for describing program interfaces.",,"No","No","[""B2AI_TOPIC:5""]",,,"Yes","No","https://spec.openapis.org/oas/latest.html","https://github.com/OAI/OpenAPI-Specification/",,,,,,"No","[""Data""]",,,
"B2AI_STANDARD:359","parquet","Parquet","Data Standard","Apache Parquet is a free and open-source column-oriented data storage format in the Apache Hadoop ecosystem.","[""fileformat"", ""has_ai_application"", ""implementation_maturity_production""]","Yes","Yes","[""B2AI_TOPIC:5""]","[""B2AI_ORG:114""]",,"Yes","No","https://parquet.apache.org/",,,,,,,"Yes","[""Data""]","[""Salutogenesis Grand Challenge""]",,
"B2AI_STANDARD:360","PURL","Persistent Uniform Resource Locator","Data Standard","PURLs are Web addresses or Uniform Resource Locators (URLs) that act as permanent identifiers in the face of a dynamic and changing Web infrastructure. Instead of resolving directly to Web resources (documents, data, services, people, etc.) PURLs provide a level of indirection that allows the underlying Web addresses of resources to change over time without negatively affecting systems that depend on them. This capability provides continuity of references to network resources that may migrate from machine to machine for business, social or technical reasons.",,"No","No","[""B2AI_TOPIC:5""]","[""B2AI_ORG:43""]",,"Yes","No","https://sites.google.com/site/persistenturls/","https://code.google.com/archive/p/persistenturls/",,,,,,"No","[""Data""]","[""IA""]",,
"B2AI_STANDARD:361","PDF","Portable Document Format","Data Standard","A file format to present documents, including text formatting and images, in a manner independent of application software, hardware, and operating systems.","[""fileformat""]","No","No","[""B2AI_TOPIC:15"", ""B2AI_TOPIC:32""]",,,"Yes","No","https://en.wikipedia.org/wiki/PDF",,,,,,,"No","[""Image"", ""Text""]",,,
"B2AI_STANDARD:362","PNG","Portable Network Graphics","Data Standard","A raster-graphics file format that supports lossless data compression.","[""audiovisual"", ""fileformat""]","No","No","[""B2AI_TOPIC:15""]",,,"Yes","No","https://en.wikipedia.org/wiki/Portable_Network_Graphics",,,,,,,"No","[""Image""]",,,
"B2AI_STANDARD:363","PS","Postscript Format","Data Standard","A page description language.","[""fileformat""]","No","No","[""B2AI_TOPIC:15"", ""B2AI_TOPIC:32""]",,,"Yes","No","https://en.wikipedia.org/wiki/PostScript",,,,,,,"No","[""Image"", ""Text""]",,,
"B2AI_STANDARD:364","PMML","Predictive Model Markup Language","Data Standard","PMML (Predictive Model Markup Language) uses XML to represent mining models. The structure of the models is described by an XML Schema. One or more mining models can be contained in a PMML document. A PMML document is an XML document with a root element of type PMML","[""markuplanguage""]","No","No","[""B2AI_TOPIC:5""]",,,"Yes","No",,"https://dmg.org/pmml/v4-4-1/GeneralStructure.html",,,,,,"No","[""Data""]",,,
"B2AI_STANDARD:365","protobuf","Protocol Buffers","Data Standard","Protocol Buffers (a.k.a., protobuf) are Google's language-neutral, platform-neutral, extensible mechanism for serializing structured data.",,"No","No","[""B2AI_TOPIC:5""]","[""B2AI_ORG:37""]",,"Yes","No","https://developers.google.com/protocol-buffers/","https://github.com/protocolbuffers/protobuf",,,,,,"No","[""Data""]","[""Google""]",,
"B2AI_STANDARD:366","PROV","Provenance","Data Standard","The PROV Family of Documents defines a model, corresponding serializations and other supporting definitions to enable the inter-operable interchange of provenance information in heterogeneous environments such as the Web.",,"No","No","[""B2AI_TOPIC:5""]","[""B2AI_ORG:99""]",,"Yes","No","https://www.w3.org/TR/prov-overview/",,,,,,,"No","[""Data""]","[""W3C""]",,
"B2AI_STANDARD:367","pickle","Python pickle format","Data Standard","Serialization format for a Python object structure. “Pickling” is the process whereby a Python object hierarchy is converted into a byte stream, and “unpickling” is the inverse operation, whereby a byte stream (from a binary file or bytes-like object) is converted back into an object hierarchy.","[""fileformat""]","No","No","[""B2AI_TOPIC:5""]",,,"Yes","No","https://docs.python.org/3.8/library/pickle.html","https://github.com/python/cpython/blob/3.8/Lib/pickle.py",,,,,,"No","[""Data""]",,,
"B2AI_STANDARD:368","QuDEx","Qualitative Data Exchange Schema","Data Standard","The Qualitative Data Exchange Schema (QuDEx) allows users to discover, find, retrieve and cite complex qualitative data collections in context.",,"No","No","[""B2AI_TOPIC:5""]","[""B2AI_ORG:97""]",,"Yes","No","https://www.data-archive.ac.uk/managing-data/standards-and-procedures/metadata-standards/qudex/","https://dam.data-archive.ac.uk/standards/qudex_v03_01.xsd",,,,,,"No","[""Data""]","[""UKDA""]",,
"B2AI_STANDARD:369","RDA 10 Things","RDA CURE-FAIR 10 Things for Curating Reproducible and FAIR Research","Data Standard","A framework for implementing effective curation workflows for achieving greater FAIR-ness and long-term usability of research data and code.","[""guidelines""]","No","No","[""B2AI_TOPIC:5""]","[""B2AI_ORG:83""]",,"Yes","No","https://www.rd-alliance.org/group/cure-fair-wg/outcomes/10-things-curating-reproducible-and-fair-research","https://curating4reproducibility.org/10things/",,,,,,"No","[""Data""]","[""RDA""]",,
"B2AI_STANDARD:370","RDFS","RDF Schema","Data Standard","RDF Schema (RDFS) is the RDF vocabulary description language. RDFS defines classes and properties that may be used to describe classes, properties and other resources.",,"No","No","[""B2AI_TOPIC:5""]","[""B2AI_ORG:99""]",,"Yes","No","https://www.w3.org/TR/rdf-schema/",,,,,,,"No","[""Data""]","[""W3C""]",,
"B2AI_STANDARD:371","RIF-CS","Registry Interchange Format - Collections and Services schema","Data Standard","The Registry Interchange Format - Collections and Services (RIF-CS) Schema was developed as a data interchange format for supporting the electronic exchange of collection and service descriptions. It organises information about collections and services into the format required by the ANDS Collections Registry.",,"No","No","[""B2AI_TOPIC:5""]","[""B2AI_ORG:6""]",,"Yes","No","https://services.ands.org.au/documentation/rifcs/1.2.0/guidelines/rif-cs.html",,,,,,,"No","[""Data""]","[""ARDC""]",,
"B2AI_STANDARD:372","RO-CRATE","Research Object Crate","Data Standard","A community effort to establish a lightweight approach to packaging research data with their metadata. It is based on schema.org annotations in JSON-LD, and aims to make best-practice in formal metadata description accessible and practical for use in a wider variety of situations, from an individual researcher working with a folder of data, to large data-intensive computational research environments.","[""has_ai_application"", ""implementation_maturity_production""]","Yes","Yes","[""B2AI_TOPIC:5""]","[""B2AI_ORG:116""]",,"Yes","No","https://www.researchobject.org/ro-crate/","https://www.researchobject.org/ro-crate/specification.html","doi:10.3233/DS-210053",,,,,"Yes","[""Data""]","[""Functional Genomics Grand Challenge""]",,
"B2AI_STANDARD:373","RDF","Resource Description Framework","Data Standard","describe anything",,"No","No","[""B2AI_TOPIC:5""]","[""B2AI_ORG:99""]",,"Yes","No","https://www.w3.org/TR/rdf-schema/",,,,,,,"No","[""Data""]","[""W3C""]",,
"B2AI_STANDARD:374","Safetensors","Safetensors","Data Standard","A new simple format for storing tensors safely (as opposed to pickle) and that is still fast (zero-copy).","[""fileformat""]","No","No","[""B2AI_TOPIC:5""]",,,"Yes","No",,"https://github.com/huggingface/safetensors",,,,,,"No","[""Data""]",,,
"B2AI_STANDARD:375","SVG","Scalable Vector Graphics Format","Data Standard","Scalable Vector Graphics (SVG) Version 1.1, a modularized language for describing two-dimensional vector and mixed vector/raster graphics in XML.","[""audiovisual"", ""fileformat""]","No","No","[""B2AI_TOPIC:15""]","[""B2AI_ORG:99""]",,"Yes","No","https://www.w3.org/Graphics/SVG/About.html",,,,,,,"No","[""Image""]","[""W3C""]",,
