"id","acronym","name","category","description","collections","hasAIApplication","isMature","concerns_data_topic","has_relevant_organization","responsible_organization","isOpen","registration","URL","formalSpec","publication","trainingResources","subclassOf","contributionDate","relatedTo","usedInBridge2AI","topic","relevantOrgNames","responsibleOrgAcronym","responsibleOrgName"
"B2AI_STANDARD:637","LGVF","Longitudinal Glaucomatous Visual Field data","Reference Data Or Dataset","Longitudinal visual field data of 139 glaucoma patients.","[""eyedata""]","No","No","[""B2AI_TOPIC:24""]",,,"Yes","Yes","http://www.rodrep.com/data-sets.html",,"doi:10.1167/iovs.13-12492",,,,,"No","[""Ophthalmic Imaging""]",,,
"B2AI_STANDARD:638","MIDRC","Medical Imaging and Data Resource Center","Reference Data Or Dataset","A linked-data commons that coordinates access to data and harmonizes data management activities at three critical stages - (1) intake, including curation, de-identification, abstraction, and quality assessment (2) annotation and labelling of images and other data using semi-automated approaches and (3) distributed access and query methods.",,"No","No","[""B2AI_TOPIC:15""]",,,"Yes","Yes","https://www.midrc.org/",,,,,,,"No","[""Image""]",,,
"B2AI_STANDARD:639","MIMIC","Medical Information Mart for Intensive Care","Reference Data Or Dataset","Deidentified, multimodal patient data","[""clinicaldata"", ""multimodal"", ""text""]","No","No","[""B2AI_TOPIC:9""]","[""B2AI_ORG:57""]",,"Yes","Yes","https://mimic.mit.edu/",,,,,,,"No","[""EHR""]","[""MIT-LCP""]",,
"B2AI_STANDARD:640","Messidor","Methods to Evaluate Segmentation and Indexing Techniques in the field of Retinal Ophthalmology dataset","Reference Data Or Dataset","The 1200 eye fundus color numerical images of the posterior pole of the Messidor database were acquired by 3 ophthalmologic departments.","[""eyedata""]","No","No","[""B2AI_TOPIC:24""]",,,"Yes","Yes","https://www.adcis.net/en/third-party/messidor/",,"doi:10.5566/ias.1155",,,,,"No","[""Ophthalmic Imaging""]",,,
"B2AI_STANDARD:641","MicroLib","MicroLib","Reference Data Or Dataset","A collection of 3D microstructural datasets assembed using a single 2D input slice as training data.",,"No","No","[""B2AI_TOPIC:5""]",,,"Yes","No","https://microlib.io/","https://github.com/tldr-group/microlib","doi:10.1038/s41597-022-01744-1",,,,,"No","[""Data""]",,,
"B2AI_STANDARD:642","MS-SNSD","Microsoft Scalable Noisy Speech Dataset","Reference Data Or Dataset","A noisy speech dataset that can scale to arbitrary sizes depending on the number of speakers, noise types, and Speech to Noise Ratio.","[""speechdata""]","No","No","[""B2AI_TOPIC:36""]","[""B2AI_ORG:56""]",,"Yes","No",,"https://github.com/microsoft/MS-SNSD",,,,,,"No","[""Voice""]","[""Microsoft""]",,
"B2AI_STANDARD:643","WFDB","MIMIC Waveform Database for Biomedical Signal Processing","Reference Data Or Dataset","A large collection of physiological signals and measurements from patients in intensive care units, including electrocardiograms, photoplethysmograms, respiration, invasive and non-invasive blood pressure, and more. These measurements and signals are obtained directly from the bedside monitor, and provide a detailed view into the physiology of critically ill patients.","[""clinicaldata"", ""has_ai_application""]","Yes","No","[""B2AI_TOPIC:37""]","[""B2AI_ORG:57"", ""B2AI_ORG:115"", ""B2AI_ORG:114"", ""B2AI_ORG:117""]",,"Yes","No","https://physionet.org/content/mimic4wdb/0.1.0/",,"doi:10.13026/a2mw-f949",,,,,"Yes","[""Waveform""]","[""MIT-LCP"", ""Salutogenesis Grand Challenge"", ""AI/ML for Clinical Care Grand Challenge"", ""Precision Public Health Grand Challenge""]",,
"B2AI_STANDARD:644","Common Voice","Mozilla Common Voice data","Reference Data Or Dataset","Spoken text from public domain sources.","[""speechdata""]","No","No","[""B2AI_TOPIC:36""]","[""B2AI_ORG:59""]",,"Yes","Yes","https://voice.mozilla.org/","https://github.com/common-voice/common-voice","doi:10.48550/arXiv.1912.06670",,,,,"No","[""Voice""]","[""Mozilla""]",,
"B2AI_STANDARD:645","MSP-Podcast","MSP Podcast Corpus","Reference Data Or Dataset","100 hours by over 100 speakers.","[""speechdata""]","No","No","[""B2AI_TOPIC:36""]",,,"Yes","Yes","https://ecs.utdallas.edu/research/researchlabs/msp-lab/MSP-Podcast.html",,"doi:10.1109/TAFFC.2017.2736999",,,,,"No","[""Voice""]",,,
"B2AI_STANDARD:646","MSP-IMPROV","MSP-IMPROV","Reference Data Or Dataset","20 sentences by 12 actors; 4 emotions, with video","[""speechdata""]","No","No","[""B2AI_TOPIC:36""]",,,"Yes","Yes","https://ecs.utdallas.edu/research/researchlabs/msp-lab/MSP-Improv.html",,"doi:10.1109/TAFFC.2016.2515617",,,,,"No","[""Voice""]",,,
"B2AI_STANDARD:647","MuSIC data","Multi-Scale Integrated Cell data","Reference Data Or Dataset","Two central approaches for mapping cellular structure – protein fluorescent imaging and protein biophysical association – each generate extensive datasets but of distinct qualities and resolutions that are typically treated separately. The MuSIC map is designed to address this challenge, by integrating immunofluorescent images in the Human Protein Atlas with ongoing affinity purification experiments from the BioPlex resource. The result is a unified hierarchical map of eukaryotic cell architecture. In the MuSIC hierarchy, nodes represent systems and arrows indicate containment of the lower system by the upper. Node color indicates known (gold) or putative novel (purple) systems. The size of each circle is based on the number of proteins in the system. The relative height of each system in the layout is determined based on the predicted diameter of the system in MuSIC.","[""multimodal""]","No","No","[""B2AI_TOPIC:26"", ""B2AI_TOPIC:28""]",,,"Yes","No","http://doi.org/10.18119/N9188W","https://github.com/idekerlab/MuSIC","doi:10.1038/s41586-021-04115-9",,,,,"No","[""Protein"", ""Proteome""]",,,
"B2AI_STANDARD:648","MELD","Multimodal EmotionLines Dataset","Reference Data Or Dataset","Derived from EmotionLines. Includes more than 1400 dialogues and 13000 utterances from the Friends TV series.","[""speechdata""]","No","No","[""B2AI_TOPIC:36""]",,,"Yes","No",,"https://github.com/SenticNet/MELD",,,,,,"No","[""Voice""]",,,
"B2AI_STANDARD:649","NHANES","National Health and Nutrition Examination Survey","Reference Data Or Dataset","The National Health and Nutrition Examination Survey (NHANES) is a program of studies designed to assess the health and nutritional status of adults and children in the United States. The survey is unique in that it combines interviews and physical examinations. NHANES is a major program of the National Center for Health Statistics (NCHS).","[""clinicaldata""]","No","No","[""B2AI_TOPIC:5""]","[""B2AI_ORG:14""]",,"Yes","No","https://www.cdc.gov/nchs/nhanes/index.htm",,,,,,,"No","[""Data""]","[""CDC NCHS""]",,
"B2AI_STANDARD:650","PCORNet Data","National Patient-Centered Clinical Research Network data","Reference Data Or Dataset","Clinical data from 9 primary partners.",,"No","No","[""B2AI_TOPIC:4""]","[""B2AI_ORG:81""]",,"No","Yes","https://pcornet.org/data/",,,,,,,"No","[""Clinical Observations""]","[""PCORI""]",,
"B2AI_STANDARD:651","NISQA-Corpus","NISQA Speech Quality Corpus","Reference Data Or Dataset","14k speech samples with simulated background noise and live degradation conditions.","[""speechdata""]","No","No","[""B2AI_TOPIC:36""]",,,"Yes","No",,"https://github.com/gabrielmittag/NISQA/wiki/NISQA-Corpus","doi:10.21437/Interspeech.2021-299",,,,,"No","[""Voice""]",,,
"B2AI_STANDARD:652","NLM-Chem-BC7","NLM-Chem BioCreative VII Chemical Identification corpus","Reference Data Or Dataset","204 full-text PubMed Central (PMC) articles, fully annotated for chemical entities by 12 NLM indexers for both span (i.e. named entity recognition) and normalization (i.e. entity linking) using MeSH.",,"No","No","[""B2AI_TOPIC:16"", ""B2AI_TOPIC:3""]","[""B2AI_ORG:74""]",,"Yes","No","https://ftp.ncbi.nlm.nih.gov/pub/lu/NLM-Chem-BC7-corpus/",,"doi:10.1093/database/baac102",,,,,"No","[""Cheminformatics"", ""Literature""]","[""NIH NLM""]",,
"B2AI_STANDARD:653","Noisy","Noisy Dataset","Reference Data Or Dataset","Clean and noisy parallel speech database. Also known as VBD, Voice Bank + DEMAND. Speech samples from VCTK dataset.","[""speechdata""]","No","No","[""B2AI_TOPIC:36""]",,,"Yes","No","https://datashare.is.ed.ac.uk/handle/10283/2791",,"doi:10.7488/ds/2117",,,,,"No","[""Voice""]",,,
"B2AI_STANDARD:654","OARD","Open annotation for rare diseases dataset","Reference Data Or Dataset","A real-world-data-derived resource with annotation for rare-disease-related phenotypes. This resource is derived from the EHRs of two academic health institutions containing more than 10 million individuals spanning wide age ranges and different disease subgroups. By leveraging ontology mapping and advanced natural-language-processing (NLP) methods, OARD automatically and efficiently extracts concepts for both rare diseases and their phenotypic traits from billing codes and lab tests as well as over 100 million clinical narratives.","[""clinicaldata""]","No","No","[""B2AI_TOPIC:7"", ""B2AI_TOPIC:25""]","[""B2AI_ORG:18""]",,"Yes","No","https://rare.cohd.io/","https://github.com/stormliucong/oard-react","doi:10.1016/j.ajhg.2022.08.002",,,,,"No","[""Disease"", ""Phenotype""]","[""Columbia DBMI""]",,
"B2AI_STANDARD:655","OCTID","Optical Coherence Tomography Image Retinal Database","Reference Data Or Dataset","An open source Optical Coherence Tomography Image Database containing different retinal OCT images with different pathological conditions.","[""eyedata""]","No","No","[""B2AI_TOPIC:24""]",,,"Yes","No","https://borealisdata.ca/dataverse/OCTID",,"doi:10.48550/arXiv.1812.07056",,,,,"No","[""Ophthalmic Imaging""]",,,
"B2AI_STANDARD:656","ORIGA-light","ORIGA-light dataset","Reference Data Or Dataset","650 retinal images annotated by trained professionals from Singapore Eye Research Institute. A wide collection of image signs, critical for glaucoma diagnosis, are annotated.","[""eyedata""]","No","No","[""B2AI_TOPIC:24""]",,,"No","No",,,"doi:10.1109/IEMBS.2010.5626137",,,,,"No","[""Ophthalmic Imaging""]",,,
"B2AI_STANDARD:657","PAPILA","PAPILA dataset","Reference Data Or Dataset","Dataset with fundus images and clinical data of both eyes of the same patient for glaucoma assessment","[""eyedata""]","No","No","[""B2AI_TOPIC:24""]",,,"Yes","No",,"https://figshare.com/articles/dataset/PAPILA/14798004/2","doi:10.1038/s41597-022-01388-1",,,,,"No","[""Ophthalmic Imaging""]",,,
"B2AI_STANDARD:658","PD database","Parkinson's speech dataset","Reference Data Or Dataset","Recordings from 20 Parkinson’s Disease patients and 20 healthy subjects.","[""speechdata""]","No","No","[""B2AI_TOPIC:36""]",,,"Yes","No","https://archive.ics.uci.edu/ml/datasets/Parkinson+Speech+Dataset+with++Multiple+Types+of+Sound+Recordings",,"doi:10.1109/JBHI.2013.2245674",,,,,"No","[""Voice""]",,,
"B2AI_STANDARD:659","PMC OA","PubMed Central Open Access Subset","Reference Data Or Dataset","Biomedical texts","[""text""]","No","No","[""B2AI_TOPIC:16""]","[""B2AI_ORG:74""]",,"Yes","No","https://www.ncbi.nlm.nih.gov/pmc/tools/openftlist/",,,,,,,"No","[""Literature""]","[""NIH NLM""]",,
"B2AI_STANDARD:660","REFUGE","Retinal Fundus Glaucoma Challenge Dataset","Reference Data Or Dataset","1200 fundus images with ground truth segmentations of the optic disc and optic cup, and clinical glaucoma labels.","[""eyedata""]","No","No","[""B2AI_TOPIC:24""]",,,"Yes","Yes","https://refuge.grand-challenge.org/",,"doi:10.1016/j.media.2019.101570",,,,,"No","[""Ophthalmic Imaging""]",,,
"B2AI_STANDARD:661","RIGA","Retinal fundus Images for Glaucoma Analysis dataset","Reference Data Or Dataset","750 retinal fundus images.","[""eyedata""]","No","No","[""B2AI_TOPIC:24""]",,,"Yes","Yes","https://deepblue.lib.umich.edu/data/concern/data_sets/3b591905z",,"doi:10.1117/12.2293584",,,,,"No","[""Ophthalmic Imaging""]",,,
"B2AI_STANDARD:662","RIM-ONE DL","Retinal IMage database for Optic Nerve Evaluation","Reference Data Or Dataset","313 retinographies from normal subjects and 172 retinographies from patients with glaucoma. All of these images have been assessed by two experts and include a manual segmentation of the disc and cup.","[""eyedata""]","No","No","[""B2AI_TOPIC:24""]",,,"Yes","No",,"https://github.com/miag-ull/rim-one-dl","doi:10.5566/ias.2346",,,,,"No","[""Ophthalmic Imaging""]",,,
"B2AI_STANDARD:663","ROC","Retinopathy Online Challenge data","Reference Data Or Dataset","Currently, we have released a first data set, aimed at CAD of microaneurysms and dot hemorrhages. These abnormalities are amongst the first signs of the presence of diabetic retinopathy.","[""eyedata""]","No","No","[""B2AI_TOPIC:24""]",,,"Yes","Yes","http://webeye.ophth.uiowa.edu/ROC/",,"doi:10.1109/TMI.2009.2033909",,,,,"No","[""Ophthalmic Imaging""]",,,
"B2AI_STANDARD:664","RNAseqDB","RNAseqDB","Reference Data Or Dataset","We developed a pipeline that processes and unifies RNA-seq data from different studies. Using the pipeline, we have processed data from the GTEx and TCGA and have successfully corrected for study-specific biases, allowing comparative analysis across studies.",,"No","No","[""B2AI_TOPIC:34""]",,,"Yes","No","https://github.com/mskcc/RNAseqDB","https://github.com/mskcc/RNAseqDB","doi:10.1038/sdata.2018.61",,,,,"No","[""Transcriptome""]",,,
"B2AI_STANDARD:665","SEMAINE","SEMAINE dataset","Reference Data Or Dataset","95 dyadic conversations from 21 subjects. Each subject converses with another playing one of four characters with emotions; 5 FeelTrace annotations - activation, valence, dominance, power, intensity.","[""speechdata""]","No","No","[""B2AI_TOPIC:36""]",,,"Yes","Yes","https://semaine-db.eu/",,,,,,,"No","[""Voice""]",,,
"B2AI_STANDARD:666","SemMedDB","Semantic MEDLINE Database","Reference Data Or Dataset","A repository of semantic predications (subject-predicate-object triples) extracted from the entire set of PubMed citations.","[""text""]","No","No","[""B2AI_TOPIC:16""]","[""B2AI_ORG:74""]",,"Yes","Yes","https://lhncbc.nlm.nih.gov/ii/tools/SemRep_SemMedDB_SKR.html","https://github.com/lhncbc/SemRep/tree/master","doi:10.1093/bioinformatics/bts591",,,,,"No","[""Literature""]","[""NIH NLM""]",,
"B2AI_STANDARD:667","GigaSpeech","Speechcollab GigaSpeech","Reference Data Or Dataset","10,000 hours of transcribed audio","[""speechdata""]","No","No","[""B2AI_TOPIC:36""]",,,"Yes","Yes",,"https://github.com/SpeechColab/GigaSpeech","doi:10.48550/arXiv.2106.06909",,,,,"No","[""Voice""]",,,
"B2AI_STANDARD:668","Sound Commander","Spoken Commands dataset","Reference Data Or Dataset","A database of free audio samples of single-word commands, English pronunciations.","[""speechdata""]","No","No","[""B2AI_TOPIC:36""]",,,"Yes","No",,"https://github.com/JohannesBuchner/spoken-command-recognition",,,,,,"No","[""Voice""]",,,
"B2AI_STANDARD:669","SWC","Spoken Wikipedia Corpora","Reference Data Or Dataset","Text-aligned spoken Wikipedia articles.","[""speechdata"", ""text""]","No","No","[""B2AI_TOPIC:16"", ""B2AI_TOPIC:36""]",,,"Yes","No","https://nats.gitlab.io/swc/",,"doi:10.1007/s10579-017-9410-y",,,,,"No","[""Literature"", ""Voice""]",,,
"B2AI_STANDARD:670","DiaRetDb1","Standard Diabetic Retinopathy Database Calibration level 1 dataset","Reference Data Or Dataset","89 fundus images with segmentation and annotated for different diabetic retinopathies","[""eyedata""]","No","No","[""B2AI_TOPIC:24""]",,,"Yes","No","https://www.it.lut.fi/project/imageret/diaretdb1/",,"doi:10.5244/C.21.15",,,,,"No","[""Ophthalmic Imaging""]",,,
"B2AI_STANDARD:671","SCOP","Structural Classification of Proteins","Reference Data Or Dataset","The SCOP database, created by manual inspection and abetted by a battery of automated methods, aims to provide a detailed and comprehensive description of the structural and evolutionary relationships between all proteins whose structure is known.","[""proteindata""]","No","No","[""B2AI_TOPIC:26""]",,,"Yes","No","http://scop.mrc-lmb.cam.ac.uk/",,"doi:10.1093/nar/gkz1064",,,,,"No","[""Protein""]",,,
"B2AI_STANDARD:672","STARE","STructured Analysis of the REtina dataset","Reference Data Or Dataset","~400 raw images","[""eyedata""]","No","No","[""B2AI_TOPIC:24""]",,,"Yes","No","http://cecas.clemson.edu/~ahoover/stare/",,"doi:10.1109/TMI.2003.815900",,,,,"No","[""Ophthalmic Imaging""]",,,
"B2AI_STANDARD:673","SBP Mosiac","Subbasal nerve plexus Mosaic","Reference Data Or Dataset","Subbasal nerve plexus Mosaic images acquired in vivo using laser-scanning confocal microscopy of the cornea in healthy subjects and type 2 diabetes mellitus subjects of the same age. Mosaics represent wide-field images of the plexus incorporating 3D nerve path data projected onto a 2D plane.","[""eyedata""]","No","No","[""B2AI_TOPIC:24""]",,,"Yes","No","https://figshare.com/collections/SBP_Mosaic_Dataset/3950197",,"doi:10.1038/s41598-018-32410-5",,,,,"No","[""Ophthalmic Imaging""]",,,
"B2AI_STANDARD:674","SUPERFAMILY","SUPERFAMILY database","Reference Data Or Dataset","A database of structural and functional annotation for all proteins and genomes. The SUPERFAMILY annotation is based on a collection of hidden Markov models, which represent structural protein domains at the SCOP superfamily level. A superfamily groups together domains which have an evolutionary relationship. The annotation is produced by scanning protein sequences from over 3,200 completely sequenced genomes against the hidden Markov models.",,"No","No","[""B2AI_TOPIC:13"", ""B2AI_TOPIC:26""]",,,"Yes","No","https://supfam.org/",,"doi:10.1093/nar/gky1130",,,,,"No","[""Genome"", ""Protein""]",,,
"B2AI_STANDARD:675","SAVEE","Surrey Audio-Visual Expressed Emotion Dataset","Reference Data Or Dataset","4 male actors in 7 different emotions, 480 British English utterances in total, including video of speaker faces.","[""speechdata""]","No","No","[""B2AI_TOPIC:36""]",,,"Yes","Yes","http://kahlan.eps.surrey.ac.uk/savee/",,,,,,,"No","[""Voice""]",,,
"B2AI_STANDARD:676","Tatoeba","Tatoeba dataset","Reference Data Or Dataset","A database of sentences, translations, and spoken audio for use in language learning. This download contains spoken English recorded by their community.","[""speechdata""]","No","No","[""B2AI_TOPIC:36""]",,,"Yes","No","https://tatoeba.org/eng/downloads",,,,,,,"No","[""Voice""]",,,
"B2AI_STANDARD:677","Ted-LIUM","Ted-LIUM corpus","Reference Data Or Dataset","Audio talks and their transcriptions available on the TED website.","[""speechdata""]","No","No","[""B2AI_TOPIC:36""]",,,"Yes","No","https://www.openslr.org/51/",,,,,,,"No","[""Voice""]",,,
"B2AI_STANDARD:678","TCGA","The Cancer Genome Atlas","Reference Data Or Dataset","The Cancer Genome Atlas (TCGA), a landmark cancer genomics program, molecularly characterized over 20,000 primary cancer and matched normal samples spanning 33 cancer types.",,"No","No","[""B2AI_TOPIC:5""]",,,"Yes","Yes","https://www.cancer.gov/about-nci/organization/ccg/research/structural-genomics/tcga",,"doi:10.1038/ng.2764",,,,,"No","[""Data""]",,,
"B2AI_STANDARD:679","RAVDESS","The Ryerson Audio-Visual Database of Emotional Speech and Song","Reference Data Or Dataset","Speech dataset. 7356 files; 24 professional actors vocalizing lexically-matched statements and songs in a neutral North American accent.","[""speechdata""]","No","No","[""B2AI_TOPIC:36""]",,,"Yes","No","https://zenodo.org/record/1188976#.XrC7a5NKjOR",,"doi:10.1371/journal.pone.0196391",,,,,"No","[""Voice""]",,,
"B2AI_STANDARD:680","TIMIT","TIMIT Acoustic-Phonetic Continuous Speech Corpus","Reference Data Or Dataset","Recordings of 630 speakers of eight major dialects of American English, each reading ten phonetically rich sentences. It includes time-aligned orthographic, phonetic and word transcriptions as well as a speech waveform file for each utterance.","[""speechdata""]","No","No","[""B2AI_TOPIC:36""]",,,"No","Yes","https://catalog.ldc.upenn.edu/LDC93S1",,,,,,,"No","[""Voice""]",,,
"B2AI_STANDARD:681","TESS","Toronto emotional speech set","Reference Data Or Dataset","Speech dataset. 2800 recordings by 2 actresses.","[""speechdata""]","No","No","[""B2AI_TOPIC:36""]",,,"Yes","No","https://tspace.library.utoronto.ca/handle/1807/24487","https://borealisdata.ca/dataset.xhtml?persistentId=doi:10.5683/SP2/E8H2MF",,,,,,"No","[""Voice""]",,,
"B2AI_STANDARD:682","VIVAE","Variably Intense Vocalizations of Affect and Emotion Corpus","Reference Data Or Dataset","Human non-speech emotion vocalizations.","[""speechdata""]","No","No","[""B2AI_TOPIC:36""]",,,"Yes","No","https://zenodo.org/record/4066235",,,,,,,"No","[""Voice""]",,,
"B2AI_STANDARD:683","VOiCES","Voices Obscured in Complex Environmental Settings Dataset","Reference Data Or Dataset","A speech dataset targeting acoustically challenging and reverberant environments with robust labels and truth data for transcription, denoising, and speaker identification.","[""speechdata""]","No","No","[""B2AI_TOPIC:36""]",,,"Yes","No","https://iqtlabs.github.io/voices/",,,,,,,"No","[""Voice""]",,,
"B2AI_STANDARD:684","VoxPopuli","VoxPopuli","Reference Data Or Dataset","100K hours of unlabelled speech data for 23 languages, 1.8K hours of transcribed speech data for 16 languages, and 17.3K hours of speech-to-speech interpretation data for 16x15 directions.","[""speechdata""]","No","No","[""B2AI_TOPIC:36""]",,,"Yes","No",,"https://github.com/facebookresearch/voxpopuli","doi:10.18653/v1/2021.acl-long.80",,,,,"No","[""Voice""]",,,
"B2AI_STANDARD:685","WHODrug","WHODrug medicinal information dictionary","Reference Data Or Dataset","WHODrug contains individual trade names, active ingredients and additional information such as marketing authorisation holder, country of sale, pharmaceutical form and strength. All related medications are linked using a structured WHODrug alphanumeric code, connecting trade names and variation of the ingredient with the active moiety of the ingredient.","[""drugdata""]","No","No","[""B2AI_TOPIC:8""]",,,"Yes","Yes","https://who-umc.org/whodrug/whodrug-global/","https://who-umc.org/whodrug/whodrug-global/applications/download-area/","doi:10.1007/s43441-020-00130-6",,,,,"No","[""Drug""]",,,
"B2AI_STANDARD:686","WikiPathways","WikiPathways database","Reference Data Or Dataset","WikiPathways is a database of biological pathways maintained by and for the scientific community.",,"No","No","[""B2AI_TOPIC:21""]",,,"Yes","No","https://www.wikipathways.org/index.php/WikiPathways",,"doi:10.1093/nar/gkaa1024",,,,,"No","[""Networks And Pathways""]",,,
"B2AI_STANDARD:687","Gupta2021","A DICOM Standard Pipeline for Microscope Imaging Modalities","Reference Implementation","This paper proposed a pipeline for the integration of multiple microscopy imaging modalities into the PACS-DICOM universe, including the numerous metadata elements. A proof-of-concept system was developed, for validation purposes, and integrated with the Dicoogle open-source PACS, providing image storage, metadata indexing and visualization.","[""has_ai_application""]","Yes","No","[""B2AI_TOPIC:19""]","[""B2AI_ORG:25""]",,"No","Yes",,,"doi:10.1109/ISCC53001.2021.9631529","[""B2AI_STANDARD:849""]",,,,"No","[""Microscale Imaging""]","[""DICOM""]",,
"B2AI_STANDARD:688","MukhiyaLamo2021","An HL7 FHIR and GraphQL approach for interoperability between heterogeneous Electronic Health Record systems","Reference Implementation","...we offer an architecture that utilizes a resource server based on GraphQL and HL7 FHIR that establishes communication between two heterogeneous EHRs. This paper describes how the proposed architecture is implemented to achieve interoperability between two heterogeneous EHRs, HL7 FHIR and OpenMRS. The presented approach establishes secure communication between the EHRs and provides accurate mappings that enable timely health information exchange between EHRs.",,"No","No","[""B2AI_TOPIC:9""]","[""B2AI_ORG:40""]",,"Yes","No",,,"doi:10.1177/14604582211043920","[""B2AI_STANDARD:845"", ""B2AI_STANDARD:846"", ""B2AI_STANDARD:847"", ""B2AI_STANDARD:850""]",,,"[""B2AI_STANDARD:109""]","No","[""EHR""]","[""HL7""]",,
"B2AI_STANDARD:689","Tapuria2018","Comparison and transformation between CDISC ODM and EN13606 EHR standards in connecting EHR data with clinical trial research data","Reference Implementation","This work investigates the mapping and data interoperability between healthcare and research standards - EN13606 used for the EHRs and the Clinical Data Interchange Standards Consortium Operational Data Model (CDISC ODM) used for clinical research.",,"No","No","[""B2AI_TOPIC:4"", ""B2AI_TOPIC:9""]","[""B2AI_ORG:15"", ""B2AI_ORG:79""]",,"Yes","No",,,"doi:10.1177/2055207618777676",,,,"[""B2AI_STANDARD:48""]","No","[""Clinical Observations"", ""EHR""]","[""CDISC"", ""openEHR""]",,
"B2AI_STANDARD:690","Biderman2022","Datasheet for the Pile","Reference Implementation","This datasheet describes the Pile, a 825 GiB dataset of human-authored text compiled by EleutherAI for use in large-scale language modeling. The Pile is comprised of 22 different text sources, ranging from original scrapes done for this project, to text data made available by the data owners, to third-party scrapes available online.","[""datasheets""]","No","No","[""B2AI_TOPIC:32""]",,,"Yes","No",,,"doi:0.48550/arXiv.2201.07311",,,,,"No","[""Text""]",,,
